{
  "schemaVersion": 1,
  "kind": "catalog-validation",
  "status": "validated",
  "runner": "catalog",
  "generatedAt": "2026-08-14T19:12:54.397Z",
  "catalogHash": "08e106565dd0336e41367f3923aaa152c85ca5df5e5679d8956e3079c2f10b42",
  "coverage": "v1-seed",
  "catalogCases": 77,
  "validatedCases": 77,
  "semantic": {
    "status": "not-run",
    "reason": "Catalog validation does not execute an agent or grade semantic output."
  }
}
